{
  "acquired_at": "2026-09-03T16:40:00Z",
  "architecture": "x86_64",
  "schema_version": "1.0",
  "services": [
    {
      "build": {
        "base_image": "eclipse-temurin@sha256:db1689535962d757a5adabf57387584ed543d38c0b9d1fe870123ea362ad73b0",
        "dockerfile": "infra/fuseki/Dockerfile",
        "output_image": "ocor/jena-fuseki:6.2.0",
        "output_sha256": "a1eb484a7d056a897c7bc832fb735b06136fc876aa90da3055d9882bc1b8d9e3",
        "source_sha512": "ba65f5867d2d4741b2ed9e2af5a0d4fbb447909894ab2a0c6bc4dac8997f4fe339c87b13c48d45d054977769f0f8bf763ea346b1f7792d5cdc458041bd43a132"
      },
      "id": "fuseki",
      "license": "Apache-2.0",
      "official_source": true,
      "source": "https://archive.apache.org/dist/jena/binaries/apache-jena-fuseki-6.2.0.tar.gz",
      "version": "6.2.0"
    },
    {
      "id": "kafka",
      "image": "confluentinc/cp-kafka@sha256:24cdd3a7fa89d2bed150560ebea81ff1943badfa61e51d66bb541a6b0d7fb047",
      "license": "Apache-2.0",
      "official_source": true,
      "source": "https://hub.docker.com/r/confluentinc/cp-kafka",
      "version": "7.6.0"
    },
    {
      "id": "keycloak",
      "image": "quay.io/keycloak/keycloak@sha256:9d1f1b2b7261ff53c66cb1092dfcdc34a5fb77e81f9e6a6e75b8b6a795de8067",
      "license": "Apache-2.0",
      "official_source": true,
      "source": "https://quay.io/repository/keycloak/keycloak",
      "version": "26.7.2"
    },
    {
      "id": "opa",
      "image": "openpolicyagent/opa@sha256:39daf255ae7f25d81103f03a0c18308a50b7b5bb67907bed6166f70e24a970ff",
      "license": "Apache-2.0",
      "official_source": true,
      "source": "https://hub.docker.com/r/openpolicyagent/opa",
      "version": "1.20.1"
    },
    {
      "id": "openbao",
      "image": "quay.io/openbao/openbao@sha256:11fd73a2102cda9c55d5d881a8c3210303146a7ec1e8ac76f526e175c6d24641",
      "license": "MPL-2.0",
      "official_source": true,
      "source": "https://quay.io/repository/openbao/openbao",
      "version": "2.6.2"
    },
    {
      "id": "postgresql",
      "image": "postgres@sha256:33f923b05f64ca54ac4401c01126a6b92afe839a0aa0a52bc5aeb5cc958e5f20",
      "license": "PostgreSQL",
      "official_source": true,
      "source": "https://hub.docker.com/_/postgres",
      "version": "16"
    },
    {
      "id": "qdrant",
      "image": "qdrant/qdrant@sha256:d122138f76868edba68d36cb0833139c1d1761f00f09e48e61f8314196e6a4c6",
      "license": "Apache-2.0",
      "official_source": true,
      "source": "https://hub.docker.com/r/qdrant/qdrant",
      "version": "1.15.1"
    },
    {
      "id": "spire-agent",
      "image": "ghcr.io/spiffe/spire-agent@sha256:41b0dcd8b258a69db9e2768292a060766fb76fd866e4bc925849981ea1b825ff",
      "license": "Apache-2.0",
      "official_source": true,
      "source": "https://github.com/spiffe/spire/pkgs/container/spire-agent",
      "version": "1.15.3"
    },
    {
      "id": "spire-server",
      "image": "ghcr.io/spiffe/spire-server@sha256:4082f30d3e0ddc4000a171392c4ea174345ee44d161ee917c70b97b2ecfba141",
      "license": "Apache-2.0",
      "official_source": true,
      "source": "https://github.com/spiffe/spire/pkgs/container/spire-server",
      "version": "1.15.3"
    },
    {
      "id": "terminusdb",
      "image": "terminusdb/terminusdb-server@sha256:58f829d5a96b3bc8e63811270c766ea4603fae0c948dced724de481461b4d073",
      "license": "Apache-2.0",
      "official_source": true,
      "source": "https://hub.docker.com/r/terminusdb/terminusdb-server",
      "version": "12.0.7-noroot"
    },
    {
      "id": "typedb",
      "image": "typedb/typedb@sha256:7555df2fffd5354553143facbfc81a58ce7036e4cc8b3b50bc7139faff4a721f",
      "license": "MPL-2.0",
      "official_source": true,
      "source": "https://hub.docker.com/r/typedb/typedb",
      "version": "3.12.3"
    }
  ]
}
